{"fixture_only":true,"output_unit":"Flyology.Generated","overlay_version":1,"records":[{"ada_type":"Wire_Shape.Public_Record","declaration_id":"decl:wire_shape.public_record#public","fields":[{"ada_component":"Enabled","ada_type":"Boolean","component_id":"decl:wire_shape.public_record.enabled#public","presentation_name":"enabled"},{"ada_component":"Signed","ada_type":"Wire_Shape.Signed_16","component_id":"decl:wire_shape.public_record.signed#public","presentation_name":"signed"},{"ada_component":"Unsigned","ada_type":"Wire_Shape.Unsigned_16","component_id":"decl:wire_shape.public_record.unsigned#public","presentation_name":"unsigned"}],"logical_type_name":"wire_shape.public_record"}],"serialization_limits":{"maximum_byte_length":64,"maximum_container_items":16,"maximum_logical_events":64,"maximum_nesting_depth":8,"maximum_text_length":64},"type_ir_commit":"78e6726a80d02b22f573fed3f65538cafd89fc0d","type_ir_semantic_fingerprint":"e5f5da08e77e057960fe9ab987b3400e5557a017ae62fcdaa8d4e376042d7f76","type_ir_source_sha256":"92aa85c19c3d0dcfd531f42b75743559efd4f80919942a9acce5f5e15d323c4a","with_units":["Wire_Shape"]}
